Date,NewsPaper,Headline,MainText
20231215,cnn,Experts call for more diversity to combat bias in artificial intelligence,"Calvin Lawrence has dedicated his career to artificial intelligence. But even after decades of experience in computer engineering, he said one thing remains incredibly rare. “I’ve worked on many AI projects over the last 25 years, not more than two [of my colleagues] looked like me,” Lawrence, who is Black, said. Artificial intelligence holds the promise of rapidly reshaping our society, but with that promise, Lawrence said, comes the challenge of confronting and dismantling biases that can be encoded into emerging technology. Lawrence is the author of the book, “Hidden in White Sight,” which examines how AI contributes to systemic racism. AI is informed by the data it’s built upon and at times that data can be racist, sexist and flawed. In August, a Black mom in Detroit sued the city after she says she was falsely arrested while eight months pregnant because officers linked her to a crime through facial recognition technology. Detroit’s police chief later blamed “poor investigative work.” A 2022 study found a robot trained by AI was more likely to associate Black men with being criminals, or women with being homemakers. The team of researchers concluded the continued use of such technology risked “amplifying malignant stereotypes” that fuel racism and misogyny. In New York City, the local health department recently expanded a coalition challenging clinical algorithms that adjust for race because they say the outcomes are often harmful to people of color. These algorithms have been shown to overestimate a person of color’s health, according to a statement from the New York City Department of Health and Mental Hygiene, which can cause a delay in treatment. In a statement shared with CNN, a spokesperson for OpenAI, the company behind ChatGPT and other artificial general intelligence (AGI) models, said bias is a significant issue across the industry and OpenAI is dedicated to “researching and reducing bias, and other risks, in our models.” “We are continuously iterating on our models to reduce bias and mitigate harmful outputs,” the company said in a statement, adding that for every new model released, OpenAI publishes research on how they are working to achieve those goals. The best way to ensure AI reflects the experiences of people of color, Lawrence said, is to make sure they’re employed and engaged in every step of the process. “You certainly don’t have a lot of Black folks or data scientists participating in the process of deploying and designing AI solutions,” he said. “The only way you can get them to have seats at the table, you have to educate them.” Increasing diversity Studies have found that the lack of diversity and representation in technology fields begins well before college. Students of color generally have less access to foundational computer science courses in high school, a 2023 report by the Code.org Advocacy Coalition found. While 89% of Asian students and 82% of White students had access to these courses respectively, 78% of Black and Hispanic and 67% of Native American students had this same privilege. “These opportunities are not evenly distributed, and that is a problem,” said Andres Lombana-Bermudez, a faculty associate at the Harvard University Berkman Klein Center for Internet and Society.  That disparity in access can also lead to fewer people of color studying computer science and artificial intelligence at the collegiate level, Lombana-Bermudez said. In 2022, more than two-thirds of all doctorates in computer science, computer engineering or information in the United States were awarded to non-permanent U.S. residents for whom no ethnicity is available, according to the 2022 Computing Research Association’s Taulbee Survey. Nearly 19% of degrees went to White doctoral candidates and 10.1% were awarded to Asian candidates, as compared with only 1.7% for Hispanic graduates and 1.6% for Black graduates. Lawrence said he believes diversifying the field of artificial intelligence could make the technology safer and more ethical. Lawrence said he started the nonprofit, AI 4 Black Kids, which works to educate Black children about artificial intelligence and machine learning from a young age, with the hope of one day increasing representation in the field. “AI is trained on so few historical points of view … the goal for me is, having more Black people involved in that process,” he said. The nonprofit offers mentorship programs to kids aged 5 to 19, as well as scholarships and college counseling, Lawrence said. Combating bias in AI requires not only increasing racial diversity, but a diversity of thought as well, Lombana-Bermudez said. He encourages employing sociologists, lawyers, political scientists and other types of humanities-oriented academics to help contribute to the conversation around AI and ethics. Lombana-Bermudez said his hope is that future generations may alleviate some of the problems of bias and inaccessibility because they’re growing up alongside the technology. “I am hopeful that this will change and in the future, we will have better technologies,” he said. “But it’s a struggle, and it’s not easy. It is complex.”"
20230126,foxnews,ChatGPT leads lawmakers to call for regulating artificial intelligence,"The rise of the chatbot ChatGPT, with its ability to generate informed, sophisticated text, is leading lawmakers to push for government intervention in the realm of artificial intelligence. Democrats and Republicans alike are growing increasingly concerned over the development of new AI technologies, and how they could impact society if there are no rules in place. ""Obviously, I think it's something we need to pay close attention to,"" Sen. Josh Hawley, R-Mo., told Fox News when asked about how Congress might approach AI. Others have used ChatGPT itself to illustrate their point that Congress needs to act, and soon. Rep. Ted Lieu, D-Calif., wrote in a New York Times op-ed on the subject earlier this week, and even used ChatGPT to write the first paragraph by entering the prompt: ""Write an attention grabbing first paragraph of an op-ed on why artificial intelligence should be regulated."" AL GORE EXPLAINS GLOBAL AI PROGRAM THAT IS SPYING ON THOUSANDS OF FACILITIES TO MONITOR EMISSIONS  Lieu noted in the piece that, having a degree in computer science, he is ""enthralled"" and ""excited"" by artificial intelligence, but cautioned that ""as a member of Congress, I am freaked out by AI, specifically AI that is left unchecked and unregulated."" Lieu is pushing for the establishment of a federal agency to regulate AI, so that experts can propose rules, although he recognized that it would be a difficult undertaking.  ARTIFICIAL INTELLIGENCE CHATBOT PASSES ELITE BUSINESS SCHOOL EXAM, OUTPERFORMS SOME IVY LEAGUE STUDENTS Rep. Jake Auchincloss, D-Mass., is believed by his staff to be the first member of Congress to deliver remarks on the House floor that were written by artificial intelligence. Auchincloss spoke briefly about a bill that would establish a U.S.-Israel artificial intelligence center. Auchincloss warned against lawmakers falling too far behind AI technology, comparing the situation to social media, which developed so fast Congress could not keep up.  CLICK HERE TO GET THE FOX NEWS APP For that reason, he said, Congress should act sooner rather than later to craft laws. The Associated Press contributed to this report."
20230126,cbsnews,"AI-powered ""robot"" lawyer won't argue in court after jail threats","A ""robot"" lawyer powered by artificial intelligence was set to be the first of its kind to help a defendant fight a traffic ticket in court next month. But the experiment has been scrapped after ""State Bar prosecutors"" threatened the man behind the company that created the chatbot with prison time. Joshua Browder, CEO of DoNotPay, on Wednesday tweeted that his company ""is postponing our court case and sticking to consumer rights.""Browder also said he will not be sending the company's robot lawyer to court. The AI creation — which runs on a smartphone, listens to court arguments and formulates responses for the defendant — was designed to tell the defendant what to say in real time, through headphones. But according to Browder, the prospect for bringing the first robot lawyer into the court room wasn't worth the risk of spending six months in jail.Backlash from lawyers against Browder's proposed stunt suggests that those in the legal profession have concerns over AI-powered chatbots usurping their jobs. The AI lawyer was set to take its first case on February 22, Browder had announced on Twitter.""On February 22nd at 1.30PM, history will be made. For the first time ever, a robot will represent someone in a US courtroom.   DoNotPay A.I will whisper in someone's ear exactly what to say. We will release the results and share more after it happens. Wish us luck!"" he tweeted. He did not disclose the name of the client or the court.DoNotPay has already used AI-generated form letters and chatbots to help people secure refunds for in-flight Wifi that didn't work, as well as to lower bills and dispute parking tickets, according to Browder. All told, the company has relied on these AI templates to win more than 2 million customer service disputes and court cases on behalf of individuals against institutions and organizations, he added.It has raised $27.7 million from tech-focused venture capital firms, including Andreessen Horowitz and Crew Capital.""In the past year, AI tech has really developed and allowed us to go back and forth in real time with corporations and governments,"" he told CBS MoneyWatch of recent advances. ""We spoke live [with companies and customer service reps] to lower bills with companies; and what we're doing next month is try to use the tech in a courtroom for the first time.""DoNotPay had said that it would have covered any fines if the robot were to lose the case. Legal in some, but not most courtrooms Some courts allow defendants to wear hearing aids, some versions of which are Bluetooth-enabled. That's how Browder determined that DoNotPay's technology could legally be used in this case. However, the tech that runs DoNotPay isn't legal in most courtrooms. Some states require that all parties consent to be recorded, which rules out the possibility of a robot lawyer entering many courtrooms. Of the 300 cases DoNotPay considered for a trial of its robot lawyer, only two were feasible, Browder said. ""It's within the letter of the law, but I don't think anyone could ever imagine this would happen,"" Browder said. ""It's not in the spirit of law, but we're trying to push things forward and a lot of people can't afford legal help. If these cases are successful, it will encourage more courts to change their rules.""Lawyers ""would not support this""The ultimate goal of a ""robot"" lawyer, according to Browder, is to democratize legal representation by making it free for those who can't afford it, in some cases eliminating the need for pricey attorneys.""What we are trying to do is automate consumer rights,"" Browder said.  ""New technologies typically fall into the hands of big companies first,  and our goal is put it in hands of the people first.""But given that the technology is illegal in many courtrooms, he doesn't expect to be able to commercialize the product any time soon. When he initially announced that DoNotPay's robot lawyer would appear in court, lawyers threatened him and told him he'd be sent to jail, he told CBS MoneyWatch.""There are a lot of lawyers and bar associations that would not support this,"" Browder said. Putting ChatGPT through law schoolBrowder wants to arm individuals with the same tools that large corporations can typically access, but are out of reach for those without deep resources. AI-powered chatbot ChatGPT has exploded in popularity recently for its ability to spit out coherent essays on wide-ranging topics in under one minute. The technology has drawn interest from investors, with Microsoft on Monday announcing a multibillion dollar investment in parent company OpenAI. Princeton student says his new app helps teachers find ChatGPT cheatsBut Browder highlighted its shortcomings and in some cases, lack of sophistication. ""ChatGPT is very good at holding conversations, but it's terrible at knowing the law. We've had to retrain these AIs to know the law,"" Browder said. ""AI is a high school student, and we're sending it to law school."" "
20230126,cbsnews,BuzzFeed to use OpenAI technology to create content,"Online media company BuzzFeed plans to use artificial intelligence powered by OpenAI, the company behind ChatGPT, to help it generate content.In a memo distributed to BuzzFeed staff on Thursday and obtained by CBS MoneyWatch, CEO Jonah Peretti said AI will play an increasingly large role in the company's operations. Specifically, it plans to use the technology to move beyond curation to help create personality quizzes that ask users questions and generate text write-ups based on their responses.AI ChatGPT is helping CEOs think. Will it also take your job?Artists sue AI company for billions, alleging ""parasite"" app used their work for freePeretti also said AI will assist workers to enhance their content. ""To be clear, we see the breakthroughs in AI opening up a new era of creativity that will allow humans to harness creativity in new ways with endless opportunities and applications for good,"" he said.He noted that AI-created content will move from an ""R&amp;D stage to part of our core business"" this year. It will be used to build quizzes, help staffers brainstorm and personalize content for BuzzFeed's audience. BuzzFeed also hopes the technology will energize its business. The media company has struggled to boost growth, with its stock down nearly 40% over the last year, even with Thursday's large gain. In its latest quarter, BuzzFeed reported a net loss of $27 million on revenue of $104 million, although sales rose 15 from the year-ago period.BuzzFeed shares surged more than 150% to $2.39 in afternoon trading. OpenAI has recently taken the tech world by storm and has already been tested by companies in a number of industries that are experimenting with its capabilities and diverse applications. Its ""generative"" AI has drawn attention from leaders of industry and investors alike, and has been used to write high school essays, create legal documents, help author legislation and even write a speech delivered this week by Rep. Jake Auchincloss, D.-Mass., in the House of Representatives.Experts expect it to take over rote administrative tasks and replace some workers, while also enhancing the quality of many jobs.It will free up skilled professionals to focus on more thoughtful tasks that require the judgement of a human, experts believe.""When I ask ChatGPT what it thinks is going on with this company, it does what junior executives would do, which is they tell me what they see in a table. They say this parameter went down and this one went up in a very clear, coherent manner. But it doesn't move beyond that into the 'so what?'"" Columbia Business School professor Oded Netzer said. ""These are the types of tasks that require judgment and that humans are still very valuable in."""
20220829,cbsnews,"How a robot helps dementia patients at Minnesota nursing home: ""We are taking them back in time""","Roseville, Minnesota â Jill Breckenridge has a new friend at her Minnesota nursing home â but it's not a person. It's a special robot named Pepper that can talk and even dance with the residents to keep them active. Amid staffing shortages at nursing homes, the robot is part of a pilot program that's helping seniors both physically and mentally. Pepper's special power is using new technology to bring up old memories to help dementia patients. Breckenridge, 83, was diagnosed with Alzheimer's disease, but when Pepper shows her a video with pictures of her past, the memories come flooding back. ""I loved my horse, Lucky Strike. And they would get the cart and we put that horse in and he took us to the different rodeos and I always ran first,"" she recalled. Arshia Khan, a professor at the University of Minnesota Duluth, is the brain behind the robots. Khan said she was ""almost in tears"" after seeing Breckenridge interact with Pepper.""It was like, that is what I wanted. We are taking them back in time, because they have lost that time,"" Khan said. ""It's gone, forgotten. But I'm able to bring that back to them at least for a little while."" Breckenridge's daughter, Sharon Fenn, said she could tell her mother was having ""a wonderful time"" with the robot. ""I could tell â¦ when I was watching her. She was beaming,"" Fenn said. "
20230523,foxnews,"Digital seance: New AI tech will mimic speaking to dead family, friends","Artificial intelligence can't bring back the dead, but it may be able to simulate speaking to a lost loved one in an effort to help humans through the grieving process. The high-tech revamp of the traditional seance comes amid the wild growth of large language models, a form of AI that is trained on copious amounts of text. ChatGPT's release year has sparked discussion on how far the tech can go as the chatbot mimics human conversation and answers prompts from humans. Jarren Rocks, product designer and manager at the Los Angeles-based software development company AE Studio, is working on a program called Seance AI, which will allow people to talk with a chatbot that mimics their dead loved ones. ""It's essentially meant to be a short interaction that can provide a sense of closure. That's really where the main focus is here,"" Rocks told the outlet Futurism. ""It's not meant to be something super long term. In its current state, it's meant to provide a conversation for closure and emotional processing."" AI APP'S ABILITY TO RESURRECT LOST LOVED ONES SPARKS FEARS TECHNOLOGY IS CROSSING FANTASY-REALITY RUBICON  Humanity has long been fascinated with trying to communicate with the dead, hitting a fever pitch in the late 19th century when people flocked to attend seances and at least 4 million Americans identified as ""spiritualists."" Even cultural figures on the world stage, such as Mark Twain and Queen Victoria, dabbled in the occult by attending seances, according to the New Yorker. Such activities, however, were shunned by many other Americans and Christians, with the Catholic Church issuing a decree in 1898 that condemned spiritualistic practices and another decree in 1917 that prohibited seances.&nbsp; USING AI TO CHALLENGE DEATH'S FINALITY  With the planned AI seances, only a chatbot will be communicating with the living, but Rocks said he’s leaning into the ""magical"" aspect of the tech. ""We're trying to make it sound as magical and as mystical as possible,"" he told Futurism of Seance AI’s name. Rocks told Fox News Digital that the name of the program is ""intentionally striking because we're confident that we'll be able to provide real comfort to some people."" He added that he and AE Studio are ""greatly concerned about AI safety"" and that they want ""to draw attention to the potential implications of the technology"" – but he said they do not want to halt AI's progress though they support ""healthy regulation."" The program employs tech from OpenAI, the AI lab behind ChatGPT, and prompts users to tell the program the name of the person with whom they wish to speak, their age, personality traits and how they died, according to the outlet. Users will also upload text from their deceased loved one as a template on how the deceased person communicated when they were alive. ANTI-'TERMINATOR': AI NOT A 'CREATURE' WORKING TOWARD SELF-AWARENESS, OPENAI CEO ALTMAN SAYS Once the information is uploaded, the user is taken to a webpage that shows a flame and then can send a message to their simulated loved one. The chatbot responds based on the information it was given, simulating the deceased loved one, Futurism reported. Rocks told Fox News Digital that he had been considering building such technology since the advent of large language models, noting that he and his co-workers at AE Studio have all experienced loss of a loved one. ""Personally, I'm not as curious about the other side as I am addressing the grief that we deal with on this side,"" he said. ""We as people have been obsessed with understanding what is beyond death for a very long time, and while there are many grief-tech solutions for counseling, or therapy, few address personal loss so boldly.""  The program, which strikes a similar tone as a ""Black Mirror"" episode that details the hyper-realistic synthetic recreation of a dead character, is not intended to be used on a regular basis, according to Rocks. AI COULD GO 'TERMINATOR,' GAIN UPPER HAND OVER HUMANS IN DARWINIAN RULES OF EVOLUTION, REPORT WARNS ""For short conversations, I think it feels decently human. I think it falls apart a little bit [when you] start to pick up on repetitions,"" Rocks said. ""It's following a pattern, it doesn't really know exactly what's going on."" Rocks compared the program to a high-tech Ouija board that can be used for closure purposes.&nbsp; ""A traditional seance isn't something that lasts forever. Personally, I think the short time span helps encourage closure, a tool to help you process some unresolved emotions. That said, there are some potential long-term applications that could be viable, and we'll likely launch other features later on,"" he told Fox News Digital, pointing to potentially building a feature such as an ""AI ghost of someone at a grave site."" ""My key priority for Seance AI is that we provide people with tools to help them process loss,"" he added.  Artificial intelligence has gained traction among people who are grieving the loss of a loved one, including through recreating a deceased person’s voice. CLICK HERE TO GET THE FOX NEWS APP South Korea-based tech firm DeepBrain AI crafted a program called ""Re;memory,"" which allows users to upload video, audio and photos of deceased people that is then used to create a virtual version of the person that can communicate with humans. In China, tech developers are building what they dubbed as ""griefbots"" so people can communicate with deceased loved ones, according to Insider. Rocks said SeanceAI will launch Tuesday, including testing a free tier level of the program as well as a paid tier for longer-term users."
