Date,NewsPaper,Headline,MainText
20240322,foxnews,Luke Bryan praises new Tennessee AI legislation protecting musicians: ‘What an amazing precedent to set’,"Luke Bryan is celebrating new protections from artificial intelligence for musicians in Nashville. Tennessee Gov. Bill Lee signed off on the legislation, dubbed the Ensuring Likeness, Voice, and Image Security Act, or ""ELVIS Act"" on Thursday. Bryan was on hand to celebrate the occasion, which was held at the historic Broadway honky-tonk Robert’s Western World in Nashville, Tennessee. ""What an amazing precedent to set for the state of Tennessee,"" Bryan told the crowd, per a statement from the Human Artistry Campaign. ""The leaders of this are showing artists who are moving here following their dreams that our state protects what we work so hard for, and I personally want to thank all of our legislators and people who made this bill happen.""  WHAT IS ARTIFICIAL INTELLIGENCE (AI)? He continued, ""It's hard to wrap your head around what is going on with AI, but I know the ELVIS Act will help protect our voices.""&nbsp; Tennessee is one of three states where name, photographs and likeness are considered a property right rather than a right of publicity, and the ELVIS act now adds vocal likeness to the list. ""It's hard to wrap your head around what is going on with AI, but I know the ELVIS Act will help protect our voices.""  The bipartisan bill, which passed unanimously in the state General Assembly, also promises to create a new civil action by which people can be held liable if they publish or perform an individual's voice without permission as well as use a technology to produce an artist's name, photographs, voice or likeness without the proper authorization, according to the Associated Press. ""From Beale Street to Broadway, to Bristol and beyond, Tennessee is known for our rich artistic heritage that tells the story of our great state. As the technology landscape evolves with artificial intelligence, I thank the General Assembly for its partnership in creating legal protection for our best-in-class artists and songwriters,""&nbsp;Governor Bill Lee said at the signing.  'ELVIS' DIRECTOR SAYS HOLLYWOOD'S AI REGULATION IS 'WAY BEHIND’ Artificial intelligence was a huge issue in last year’s Hollywood strikes, and SAG-AFTRA National Executive Director and Chief Negotiator Duncan Crabtree-Ireland praised the bill’s passing as well.&nbsp; ""SAG-AFTRA applauds Governor Lee for leading the nation in instituting meaningful protections against the misappropriation of voice and likeness by artificial intelligence,"" Crabtree-Ireland said in a statement. He continued, ""We hope this legislation will serve as a model for policymakers across the country and offer the support of our members who work across the music, television, film, broadcast and video game industries. SAG-AFTRA is focused on protecting its members' images, voices, and likenesses from being replicated by AI without their informed consent and fair compensation. The ELVIS Act is an important step in this direction."" Naming the legislation the ELVIS Act is fitting, given the prevalence of unauthorized usage of Elvis Presley’s likeness following his death.  CLICK HERE TO SIGN UP FOR THE ENTERTAINMENT NEWSLETTER In 1984, the Tennessee Legislature passed the Personal Rights Protection Act, which ensured that personality rights do not stop at death and can be passed down to others. It states that ""the individual rights … constitute property rights and are freely assignable and licensable, and do not expire upon the death of the individual so protected."" Similar AI legislation is being debated in Congress as well. In February, musician and ""Yellowstone"" star Lainey Wilson testified at a House Judiciary subcommittee about her experience as a ""victim"" of AI. ""I use my music and my voice to tell stories, to connect to my fans and to help them to connect to each other. My art is uniquely and literally me, my name, my likeness, my voice,"" Wilson said.&nbsp;""I do not have to tell&nbsp;you how much of a gut punch it is to have your name, your likeness or your voice ripped from you and used in ways that you could never imagine or would never allow. It is wrong, plain and simple.""  CLICK HERE TO GET THE FOX NEWS APP ""It is a personal violation that threatens a person's dignity and can put at risk everything that they have worked so hard to accomplish,"" she continued. ""An artist's voice and likeness are their property and should not take a back seat to the economic interest of companies that have not invested in or partnered with the artist."" While Wilson spoke mostly about the experience of music artists and AI-generated materials, she also touched on how AI has affected everyone, not just celebrities. ""It's not just artists who need protection, and the fans need it, too. It's needed for high school girls who have experienced&nbsp;life-altering deepfake porn&nbsp;using their faces. For elderly citizens convinced to hand over their life savings by a vocal clone of their grandchild in trouble, AI increasingly affects every single one of us, and I'm so grateful that you are considering taking action to ensure that these tools are used in a responsible way."" The Associated Press contributed to this report."
20240322,cbsnews,Meet the Chicago woman who helped bring robots to Chicago restaurants,"CHICAGO (CBS) -- Some restaurants have started using service robots to help staff with basic tasks. The bulk of the robots in Chicago's restaurants were sold by one woman who began sourcing them from China to help her own staff stay safe during the early days of the COVID-19 pandemic. Now she's a major distributor both in Chicago and Asia.You might have noticed little robots making their way through some of the city's restaurants â zooming through kitchens, or past tables, piled high with steaming plates of food.""A lot of the customers like the robot because they are really cute,"" said Stephanie Gong, one of the first restaurateurs to bring robots onto the dining room floor and into the kitchen.It all started during COVID. Gong had been running her three restaurants for decades, so she and her husband Ivan Williams were on the hunt for anything to help her keep from having to lay off her staff.""We use three different kinds of robot; cleaning robot, delivery robot, cooking robot,"" Gong said. ""I try to use robot help the worker deliver food for the customers. When I know more, I know robot is the future. Actually, robot is now.""""We didn't close one single day, and that's where the whole thing about the robotics came in. You know, she's trying to figure out a way to make it work. So she's like, 'Let me try different robots to see how they can help the staff,"" Williams said.Gong imported the robots from China, where they were already popular.""Because I was a nurse in China, so that's why I know how to protect the worker,"" Gong said.The robots allowed her staff to maintain their distance, and for Gong to retain her whole team through the pandemic.""They loved it. Like, when I teach them how to use, immediately they use. They were so busy, and we just we started a robot. Immediately they say, 'Okay, teach me how to use. I need the help,'"" she said.Kitchen workers said it cuts the time in half, especially for big batches. Gong quickly realized she wasn't the only restaurateur in need of some help.""A lot of restaurants closed, not because they don't have business, because they don't have workers,"" she said.She got some office space, and buffed up her inventory, then began selling robots to small business owners like herself, and RuTech Robotics was born.Her first successes were in China, selling to restaurant owners in her hometown. But the American market began to catch on, with Gong's RuTech Robotics as their major distributor, getting robots into restaurants around Illinois and 29 other states.""In the future, I think it would just be the norm that if a restaurant doesn't have a robot, people might not want to work there, because they will feel, 'I have to carry all the dishes. I have to do this and that,'"" Williams said.""The world is change, and the new technology is helping people a lot,"" Gong said.To those who are wary of what might feel wary of the seeming automation of everything, Gong sees it no differently than doing laundry.""I still remember when I was kids. At the time in China, they had the washing machine coming, and I remember my grandma at the time, she said 'Hand wash is better than this,' but think about today. Who don't use the washing machine?"" Gong said.Part of the reason restaurant robotics hasn't really taken hold in the U.S. has been due to the lack of availability of in-person and customer service and maintenance techs. But Gong and RuTech serve as that bridge between manufacturers and their newer American clientele."
20230519,foxnews,Texas university launches investigation after AI chatbot claims to have written seniors’ papers,"A group of graduating seniors at Texas A&amp;M University were temporarily denied their diplomas after a ChatGPT bot claimed to have written their papers.&nbsp; Per multiple reports, animal science professor Jared Mumm told his class he would be giving them incomplete grades after running their essays through a chatbot that asserted to have written all the papers. That assertion was later determined to be not entirely accurate.&nbsp; The school said no students ultimately failed the class or were barred from graduating because of this issue. Mumm is working individually with students to determine what extent AI may have been used in the assignment.&nbsp; WORLD'S FIRST AI UNIVERSITY PRESIDENT SAYS TECH WILL DISRUPT EDUCATION TENETS, CREATE ‘RENAISSANCE SCHOLARS’  Some students temporarily received an ""X"" grade, indicating an incomplete. Others have been exonerated, and their grades have been issued. At least one student admitted to using ChatGPT in the course. Other students opted to write a completely new assignment.&nbsp; ""University officials are investigating the incident and developing policies to address the use or misuse of AI technology in the classroom,"" A&amp;M-Commerce said in a statement.&nbsp; CLICK HERE TO GET THE FOX NEWS APP ""They are also working to adopt AI detection tools and other resources to manage the intersection of AI technology and higher education. The use of AI in coursework is a rapidly changing issue that confronts all learning institutions.""&nbsp;"
20230519,foxnews,'It's all gonna take over': Americans reveal fears of AI impacting every day life,"Lone Star state residents shared fears over AI's rapid advancement and how it may impact different aspects of life. ""Genuinely, I'm much more afraid for the job loss,"" said Eilidh, an Austin resident who works in retail. But Girish was more optimistic. ""People will find new avenues for jobs,"" he told Fox News. ""I think it suggests re-skilling that needs to be done.""&nbsp; WHAT ARE AMERICANS' BIGGEST FEARS SURROUNDING AI? WATCH:  WATCH MORE FOX NEWS DIGITAL ORIGINALS HERE AI technologies capable of producing professional-level text, audio and video materials have rapidly evolved in recent months. The increasing sophistication has prompted legal and ethical disputes across multiple industries around the world. Some experts in the field, like Gary Marcus, have warned of AI's many risks, like enabling bad actors to more easily commit more convincing fraud. Others, such as computer scientist Jürgen Schmidhuber, has said the same tools can be used to combat bad actors.  EVERYTHING YOU NEED TO KNOW ABOUT ARTIFICIAL INTELLIGENCE: WHAT IS IT USED FOR? Still, Dan, a Kansas City resident who was visiting Austin, said he was afraid AI would cost jobs. ""I think that's a possibility in certain industries,"" he said. As 300 million jobs worldwide could be lost or diminished because of AI advances, according to a March 26 Goldman Sachs report. The analysis predicted that the technologies could cause ""significant disruption"" to the global labor market in the coming years by fully or partially replacing humans across sectors. One person told Fox News he feared AI could cause greater problems around identity theft. Another worried that it could potentially take over the military. ARTIFICIAL INTELLIGENCE COULD REPLACE UP TO 80% OF HUMAN JOBS, EXPERT SAYS  Girish, of Austin, said he was most concerned that the data used to train AI technology systems could contain racial bias.&nbsp; ""One thing I've been thinking deeply about is the concept of racial bias and … the existing data probably which is being used to train the AI models,"" he told Fox News. ""Hopefully, that can be resolved or people are cognizant of that."" CLICK HERE TO GET THE FOX NEWS APP Eilidh, meanwhile, pointed to a March ""South Park"" episode that ChatGPT helped write. She said it indicated that content creators' jobs were also at risk. ""Artists are now kind of getting worried about the art AI things 'cause it almost feels like they don't even have a place in the job force anymore,"" she told Fox News. ""Neither do writers, 'cause eventually I feel like it's all gonna take over."" To watch the full interviews, click here."
20230519,foxnews,Wuhan University rule-breaking with AI-controlled satellite experiments: experts,"Researchers at a Chinese university last month allegedly handed over control of a satellite to an artificial intelligence (AI) program for 24 hours, showing how far the country will go to find ways to get ahead using AI technology, experts warn. ""Many Americans understandably want to hit the pause button on AI development to sort out the risk issues. China, unfortunately, is roaring ahead, as its 24-hour satellite experiment shows,"" Gordon Chang, a China expert, told Fox News Digital. Researchers at Wuhan University allegedly handed over control of the Qimingxing 1, a small Earth observation satellite, to a ground-based AI program. The program had freedom, with no human orders, assignment or intervention, the South Morning China Post reported. The researchers developed the AI using data from around the globe, creating it not to chat but to take initiative based on its training and growing understanding of natural and human activities. Lead researcher Wang Mi said that the experiment broke the rules of mission planning, which requires satellites to have specific orders or assignments before taking action.&nbsp; WORLD HEALTH ORGANIZATION ISSUES STARK WARNING ON AI'S USE IN HEALTH CARE  During the alleged experiment, Wang’s team observed the satellite as it picked out locations on Earth to make closer observations. The satellite identified an ancient city by the Ganges River in northeast India and home to the Bihar Regiment, which engaged with Chinese forces in the disputed Galwan Valley in 2020, and it also focused on the Japanese port city of Osaka, which occasionally hosts U.S. Navy vessels, according to the SMCP. A State Department spokesperson told Fox News Digital that the department was aware of reports about the Wuhan University experiment but referred to the university and China’s government for any further details.&nbsp; ""The Communist Party’s only regulation of the technology is to make sure that nobody uses AI to criticize, mock or otherwise undermine its rule,"" Chang said. ""Because we don’t want to live in a world where Chinese communists dominate AI, we have no choice but to continue development as fast as we can. China can, single-handedly, prevent humanity from adopting safeguards."" ""The bottom line: Chinese communists will do anything, which means we must match them step for step in AI,"" he added. ""This is not an ideal outcome, but ideal outcomes are not possible."" AI-ASSISTED ‘SOCIAL LISTENING’ CAN HELP TRACK HUMAN RIGHTS ABUSES AND MAP OUT ETHICAL SUPPLY CHAINS  Charles Clancy, senior vice president at MITRE and GM of MITRE Labs, told Fox News Digital that every major company operates satellites with some level of automation to begin with, including how they manage orbits, schedule data uploads and downloads as well as optimize missions, so this is just another step in the evolution of that process. ""As AI has continued to evolve, it has been able to take over more and more tasks from human operators, allowing humans to focus more on the big picture,"" Clancy said. ""Sometimes this advanced automation is code that sits on the satellite, and sometimes it is code that sits on the ground and sends instructions to satellites."" Clancy also stressed that while the specifics of the AI model remain unknown, it does not appear to be a ""particularly revolutionary"" example, most likely an imagery-based model using an algorithm to pick out ground targets. He pointed to companies like BlackSky who already use similar AI optimization for operations.&nbsp; In fact, AI will likely make it easier for programming satellites since they only make contact with ground stations ""a handful of times"" in a typical 90-minute orbit, Clancy noted.&nbsp; SOUTHERN CALIFORNIA STARTUP VAST ANNOUNCES PLANS TO LAUNCH WORLD'S FIRST COMMERCIAL SPACE STATION  Matt McInnis, a senior fellow for the Institute for the Study of War's China Program, told Fox News Digital that Beijing views AI as the key tool to help it ""leapfrog"" the U.S. military for superiority and ""allow them to make decisions in potential conflicts much quicker and more accurately."" ""China is investing a lot of in artificial intelligence across the board, but the highest priority for it is how it can help them transform their military into a true world-class power and, frankly, surpass the United States,"" McInnis said, adding that it is ""a critical component"" for that strategy. McInnis referred to recent revelations by the Israel Defense Forces that it used AI during the 2021 Gaza conflict, which helped the Israelis make fast decisions and also determine likely locations for terrorists, which led to the capture of two enemy combatant leaders.&nbsp; ""Certainly, our concern is keeping up with that in our ability to observe the battle space, observe potential conflict areas, identify targets and then process those to make decisions, and there's AI that's going to be part of that additive intensification of targets,"" McInnis said. ""Then there's the AI that's part of decision-making about targets, which is even more complex.""  FOX NEWS POLL INDICATES VOTERS FEAR AI IS BAD FOR SOCIETY ""I think that's really where China wants to go, where they can do it all in the AI-enabled cycle,"" he added.&nbsp; ""As China continues to modernize, will they be willing, on the one hand, to give up or to allow artificial intelligence to make decisions that have traditionally resided with humans or humans processing information? Are they going to truly develop AI that they can trust and be able to control?"" he said. ""In part, I think there's a lot of pressure to do this because I think [Chinese President] Xi Jinping still has a lot of doubts about the party, about the loyalty as well as the capabilities of the personnel, and sometimes AI is seen in a way as compensating for the lack of a quality and capability."""
20230519,foxnews,AI-powered RoboTire can change 4 tires twice as fast as a human,"Autonomous robot cars may be the next big thing, but robot mechanics are right behind them. RoboTire is a new technology that can change all four tires on a car two to three times faster than a human can do it alone. But it still requires a human touch — for now. After a vehicle pulls onto the device’s platform, artificial intelligence-driven machine vision identifies the wheels, spots the lugs and guides the robot arms to unscrew and remove the nuts or lug bolts, then pulls the wheels and tires off. AI-POWERED CRUISE CONTROL CAN STOP TRAFFIC JAMS BEFORE THEY START It then passes them on to a Hunter tire-changing machine, to which it transmits information about the size and type of tire, so that it’s ready to make the swap.  A human tech helps with the transition between the two, loads the fresh tire into the changer and keeps an eye on the operation, but Michigan-based RoboTire's founder and CEO Victor Darolfi said the company is working to develop the system to be fully autonomous. Darolfi told Fox News Digital the entire process can be completed in 23 minutes, and that it’s getting faster all the time as the machine continues to learn through AI.  ""It’s mainly training our machine vision system. Every motion is guided by this,"" Darolfi said. RoboTire already has a large library of information on vehicle types, wheel sizes and bolt patterns, and it can tap into that when it encounters a new one.  ""Someone can come in with a new rim combination that the robot hasn’t seen yet, but since we’re constantly retraining our models on the fly, that allows the robot to continue and not get hung up,"" Darolfi said. ""How we handle the variability is our secret sauce."" The company has four stores using RoboTire, and when one learns something new it shares it with the others. ""It figures it out itself, calls back home, and then we rerun our models every week to increase the confidence level,"" Darolfi explained.  It can even work when conditions aren’t perfect. ""What if there’s mud on the tire or snow packed into the wheel well? As long as it can see one edge of the lug nut, it can find it,"" Darolfi said.&nbsp; ""It’s like seeing through the woods. The AI helps us see the woods, and the machine vision allows us to identify the tree.""  RoboTire hasn’t publicly announced exact pricing but offers it as an all-inclusive ""robot as a service"" subscription at varying rates that take into account local salaries.&nbsp; Darolfi said most operators will see payback within a year thanks to reduced labor costs and higher production. CLICK HERE TO SIGN UP FOR THE FOX NEWS AUTOS NEWSLETTER Along with retail giant Discount Tire, it’s also being used by a Creamery Tire, a small Philadelphia-area chain that does 80 to 100 tires a day at each location and has been having great success with the one RoboTire it has. Owner Rich Shainline told Fox News Digital it’s helped the company address the ongoing labor shortage.  ""Our big thing is, we have to move product, and I can put one guy on it instead of two,"" Shainline said. ""It’s not 100%, but the vehicles it can’t handle are few and far between. And RoboTire has been great to work with."" Darolfi said his company is already testing its use on other wheeled vehicles, like side-by-side UTVs, and that the company is working on additional functions he’s not ready to reveal yet, including inspections. CLICK HERE TO GET THE FOX NEWS APP ""Imagine what can you do in and around the tire and in and around where the tire's off the vehicle,"" he said."
