Date,NewsPaper,Headline,MainText
20230329,cnn,"Using artificial intelligence and archival news articles, this teen found that Black homicide victims were less humanized in news coverage","Using artificial intelligence and archival news articles, a teenager in Northern Virginia created a program to measure media biases – and in researching older news articles, she found that Black homicide victims were less likely to be humanized in news coverage. Emily Ocasio, an 18-year-old from Falls Church, Virginia, created an AI program that analyzed FBI homicide records between 1976 and 1984 and their corresponding coverage published in The Boston Globe to determine whether victims were presented in a humanizing or impersonal way.   After analyzing 5,042 entries, the results showed that Black men under the age of 18 were 30% less likely to receive humanizing coverage than their White counterparts, Ocasio told CNN.  Black women were 23% less likely to be humanized in news stories, Ocasio added.   A news article was considered humanizing when it mentioned additional information about the victim and presented them “as a person, not just a statistic,” Ocasio said in her project presentation.     Her findings have not been reviewed by the larger scientific community, but she told CNN she hopes to expand her research and get it published in a scientific journal.     Ocasio’s project earned her second place in the prestigious Regeneron Science Talent Search on March 14 as well as a $175,000 scholarship.  Every year about 1,900 high school students from across the country participate in the competition, which started in 1942 and seeks to serve as a platform for young scientists to share original research.   Ocasio was among 40 finalists from more than 2,000 applications, according to Maya Ajmera, president and CEO of the Society for Science and executive publisher of Science News, who runs the competition sponsored by Regeneron.  “By using AI to document these biases, Emily shows that it can be safely used to help society answer complex social science questions,” her biography on the Society for Science website says. Ocasio said she has always been interested in social justice and science and saw this project as an opportunity to combine them. “Without the research, and without the statistics, you have no ability of understanding that entire communities are being left behind,” she said. Ocasio analyzed The Boston Globe’s news coverage because the newspaper had digital copies of its articles for the ’70s to ‘80s time period she focused on for her project, she said. CNN has reached out to the Boston Globe for comment.   Despite her findings, Ocasio believes science can’t explain everything: “You can never run an experiment in a lab that tells you about how racism works in society.” Ocasio, who has Puerto Rican heritage, said her own experiences helped shape her perspective of different races and cultures, and drew her to researching racism and inequalities. She wants to replicate her research to analyze other news outlets as well, she said. The talent search’s first-place winner, Neel Moudgal, told CNN the research done by the teenagers across the US is essential to helping solve some of society’s greatest challenges.   “I firmly believe that science is going to be the solution to a lot of our problems,” Moudgal said. His prize-winning project was a computer model that predicts the structure of RNA molecules to help develop tests and drugs for diseases such as cancer, autoimmune diseases, and viral infections.   Ajmera said seeing such projects from high school students gives her “an enormous hope for the future.” “We’re looking for the future scientific leaders of this country,” she said."
20230329,foxnews,"Elon Musk, Apple co-founder, other tech experts call for pause on 'giant AI experiments': 'Dangerous race'","Elon Musk, Steve Wozniak, and a host of other tech leaders and artificial intelligence experts are urging AI labs to pause development of powerful new AI systems in an open letter citing potential risks to society. The letter asks AI developers to ""immediately pause for at least 6 months the training of AI systems more powerful than GPT-4."" It was issued by the Future of Life Institute and signed by more than 1,000 people, including Musk, who argued that safety protocols need to be developed by independent overseers to guide the future of AI systems. GPT-4 is the latest deep learning model from OpenAI, which ""exhibits human-level performance on various professional and academic benchmarks,"" according to the lab.&nbsp; ""Powerful AI systems should be developed only once we are confident that their effects will be positive and their risks will be manageable,"" the letter said. The letter warns that at this stage, no one ""can understand, predict, or reliably control"" the powerful new tools developed in AI labs. The undersigned tech experts cite the risks of propaganda and lies spread through AI-generated articles that look real, and even the possibility that Ai programs can outperform workers and make jobs obsolete.&nbsp; AI EXPERTS WEIGH DANGERS, BENEFITS OF CHATGPT ON HUMANS, JOBS AND INFORMATION: ‘DYSTOPIAN WORLD’  ""AI labs and independent experts should use this pause to jointly develop and implement a set of shared safety protocols for advanced AI design and development that are rigorously audited and overseen by independent outside experts,"" the letter states. ""In parallel, AI developers must work with policymakers to dramatically accelerate development of robust AI governance systems."" ARTIFICIAL INTELLIGENCE ‘GODFATHER’ ON AI POSSIBLY WIPING OUT HUMANITY: ‘IT’S NOT INCONCEIVABLE'  The signatories, which include Stability AI CEO Emad Mostaque, researchers at Alphabet-owned DeepMind, as well as AI heavyweights Yoshua Bengio and Stuart Russell, emphasize that AI development in general should be not paused, writing that their letter is calling for ""merely a stepping back from the dangerous race to ever-larger unpredictable black-box models with emergent capabilities."" According to the European Union's transparency register, the Future of Life Institute is primarily funded by the Musk Foundation, as well as London-based effective altruism group Founders Pledge, and Silicon Valley Community Foundation. ARTIFICIAL INTELLIGENCE EXPERTS ADDRESS BIAS IN CHATGPT: ‘VERY HARD TO PREVENT BIAS FROM HAPPENING’  Musk, whose electric car company Tesla uses AI for its autopilot system, has previously raised concerns about the rapid development of AI.&nbsp; Since its release last year, Microsoft-backed OpenAI's ChatGPT has prompted rivals to accelerate developing similar large language models, and companies to integrate generative AI models into their products. CLICK HERE TO GET THE FOX NEWS APP Notably absent from the letter's signatories was Sam Altman, CEO of OpenAI.&nbsp; Reuters contributed to this report."
20230329,foxnews,"Elon Musk's AI warning is 'unprecedented' and shows 'extraordinary' level of concern, says Douglas Murray","In an open letter, tech experts and leaders in the industry called for a six-month pause on AI experiments, a move that Fox News contributor Douglas Murray believes shows a ""deep concern"" that is growing about the risks of artificial intelligence. The letter, which was signed by Elon Musk and Apple co-founder Steve Wozniak, reads, in part: ""AI systems with human-competitive intelligence can pose profound risks to society … and should be planned for and managed with commensurate care. … Unfortunately, this level of planning and management is not happening."" Murray said on ""Fox &amp; Friends"" Wednesday that the request for a moratorium is extraordinary and is a sign that experts are worried. I INTERVIEWED CHATGPT AS IF IT WAS A HUMAN; HERE'S WHAT IT HAD TO SAY THAT GAVE ME CHILLS ""The fact that there has now been this stressing that we could be in trouble. This is unprecedented,"" Murray told host Brian Kilmeade. He explained that concerns are stemming from the idea that the artificial intelligence technology is able to operate at a higher level than human intelligence. For example, Murray said ChatGPT is producing work that other technologies cannot detect as computer-generated. ""So we are already in a state where the technology is running faster than teachers in America can run,"" he said.  Tristan Harris, co-founder of the Center for Humane Technology, said on ""The Brian Kilmeade Show"" that the world is witnessing the birth of a new age. ""I know that might sound like an extreme statement to make, but I really do think of it like the birth of the nuclear age,"" Harris said. AI EXPERTS WEIGH DANGERS, BENEFITS OF CHATGPT ON HUMANS, JOBS AND INFORMATION: ‘DYSTOPIAN WORLD’  The GPT technology, Harris explained, has the ability to identify vulnerabilities in cybersecurity on command or seamlessly replicate a person’s voice using only three seconds of real audio.&nbsp; ""Our democracy, our society runs on language,"" he said. ""Code is language, law is language, contracts are language, media is language. When I can synthesize anyone saying anything else and then flood a democracy with untruths, … this is going to exponentiate a lot of the things that we saw with social media."" CLICK HERE TO GET THE FOX NEWS APP ""If you let a machine that runs on viral information, your society can sort of spin out into untruths really, really fast,"" Harris said. Murray compared the new artificial intelligence technology to the printing press, which revolutionized life in the Middle Ages. ""We don't know what the consequences of this are going to be,"" Murray said of AI development. ""And we are currently living through an era where it's printing press after printing press is being discovered underneath us."""
20230329,cbsnews,"Elon Musk, Bill Gates and other tech leaders call for pause on 'out of control' AI race","MIAMI -- Some of the biggest names in tech are calling for artificial intelligence labs to stop the training of the most powerful AI systems for at least six months, citing ""profound risks to society and humanity.""Elon Musk, Bill Gates and Steve Wozniak are among the dozens of tech leaders, professors and researchers who signed the letter, which was published by the Future of Life Institute, a nonprofit backed by Musk.The letter comes just two weeks after OpenAI announced GPT-4, an even more powerful version of the technology that underpins the viral AI chatbot tool, ChatGPT. In early tests and a company demo, the technology was shown drafting lawsuits, passing standardized exams and building a working website from a hand-drawn sketch.The letter, which was also signed by the CEO of OpenAI, said the pause should apply to AI systems ""more powerful than GPT-4."" It also said independent experts should use the proposed pause to jointly develop and implement a set of shared protocols for AI tools that are safe ""beyond a reasonable doubt.""""Advanced AI could represent a profound change in the history of life on Earth, and should be planned for and managed with commensurate care and resources,"" the letter said. ""Unfortunately, this level of planning and management is not happening, even though recent months have seen AI labs locked in an out-of-control race to develop and deploy ever more powerful digital minds that no one -- not even their creators -- can understand, predict, or reliably control.""If a pause is not put in place soon, the letter said governments should step in and create a moratorium.The wave of attention around ChatGPT late last year helped renew an arms race among tech companies to develop and deploy similar AI tools in their products. OpenAI, Microsoft and Google are at the forefront of this trend, but IBM, Amazon, Baidu and Tencent are working on similar technologies. A long list of startups are also developing AI writing assistants and image generators.Artificial intelligence experts have become increasingly concerned about AI tools' potential for biased responses, the ability to spread misinformation and the impact on consumer privacy. These tools have also sparked questions around how AI can upend professions, enable students to cheat, and shift our relationship with technology.Lian Jye Su, an analyst at ABI Research, said the letter shows legitimate concerns among tech leaders over the unregulated usage of AI technologies. But he called parts of the petition ""ridiculous,"" including the premise of asking for a hiatus in AI development beyond GPT-4. He said this could help some of the people who signed the letter preserve their dominance in the field.Musk was a founding member of OpenAI in 2015 but left three years later and has since criticized the company. Gates cofounded Microsoft, which has invested billions of dollars in OpenAI.""Corporate ambitions and desire for dominance often triumph over ethical concerns,"" Su said. ""I won't be surprised if these organizations are already testing something more advanced than ChatGPT or [Google's] Bard as we speak.""Still, the letter hints at the broader discomfort inside and outside the industry with the rapid pace of advancement in AI. Some governing agencies in China, the EU and Singapore have previously introduced early versions of AI governance frameworks."
20230329,foxnews,"Musk’s push to halt AI development makes no sense unless China is on board, GOP senator says","The top Republican on the Senate Artificial Intelligence Caucus warned Wednesday that pausing the development of AI technology could raise ""national security"" concerns on the same day that top tech industry giants called for a pause. In an open letter earlier in the day, tech industry giants like Tesla founder Elon Musk and Apple co-founder Steve Wozniak called on AI labs ""to immediately pause for at least 6 months the training of AI systems"" more advanced than the latest chatbot known as GPT-4. But Sen. Mike Rounds, R-S.D., who leads the Senate AI caucus, disagreed. ""Unless China, the Communist Party in China, is prepared to show evidence that they're going to do the same thing, I'm afraid then that we would be restricting our ability to move forward with AI for a period of six months while China does not,"" Rounds told Fox News Digital. AI EXPERTS WEIGH DANGERS, BENEFITS OF CHATGPT ON HUMANS, JOBS AND INFORMATION: ‘DYSTOPIAN WORLD’  He explained that while he believes the push for a moratorium is endorsed by ""really bright people,"" it could leave the U.S. at a ""six months to a year disadvantage"" against U.S. adversaries, which he said would pose a challenge to U.S. national security. ""That does concern me. At the same time, I know that, in their letter, they didn't say that they couldn't improve the existing structures within existing AI, and I get that. I'm just not sure that it's enforceable with our adversary or peer competitors in the rest of the world,"" Rounds said.&nbsp; ARTIFICIAL INTELLIGENCE ‘GODFATHER’ ON AI POSSIBLY WIPING OUT HUMANITY: ‘IT’S NOT INCONCEIVABLE' ""These are really bright people that have signed on to this. Maybe they think that they have the advantage,"" Rounds said. ""I’d like to hear their logic … the reasoning for why they're suggesting it right now, and what they hope to accomplish in six months.""  Rep. Jay Obernolte, R-Calif., who has led efforts to open pathways for the U.S. to improve its military capabilities through AI, concurred that such a delay could put the country at a disadvantage. ""The benefits to society will almost certainly far outweigh the costs, but it is critically important that we protect Americans from the misuse of AI systems while still enabling the industry to grow and innovate,"" Obernolte told Fox News Digital. ""Unfortunately, arbitrarily halting development of artificial intelligence is&nbsp;unlikely to solve these problems because unscrupulous actors seeking economic gain and adversaries seeking&nbsp;competitive&nbsp;advantage&nbsp;will certainly continue its development, exacerbating the potential disruption to our economy and our national security."" SENS. ROUNDS, JOHNSON TAKE ON ATF, INTRODUCE BILL TO EXPAND FULL-TIME TRAVELERS’ GUN OWNERSHIP RIGHTS Some of Rounds’ colleagues were more willing to get behind the tech industry’s bid to slow AI development. Sen. Michael Bennet, D-Colo., told Fox News Digital the American AI sector should be ""cautious."" ""When you have … some of the leading voices in tech ringing the alarm bells, saying that we need to figure out what the implications of this are gonna be for humanity before we impose another science experiment on the children in this country … we should be cautious,"" the Democrat said.  Sen. JD Vance, R-Ohio, deferred to the experts warning about AI’s potentially harmful capabilities. ""The one thing I'd say is that if Elon Musk and Wozniak and some of these people who know the computing industry better than anybody else are saying that we should be cautious, I'm inclined to agree with them. Because these guys know what they're talking about,"" Vance told Fox News Digital. The letter, published by Future of Life, warned that ""Powerful AI systems should be developed only once we are confident that their effects will be positive and their risks will be manageable."" Failure to do that could ""risk loss of control of our civilization,"" it claims."
20230329,nbcnews,GPT-4 and OpenAI have shifted the direction of these 5 companies,"SAN FRANCISCO — Businesses and nonprofit groups agree on one thing after testing some of the latest in artificial intelligence: It is already changing the course of their operations.  Five organizations that were among the first to get access to GPT-4, the latest product from San Francisco startup OpenAI, said in interviews that they were reassigning employees, reorienting internal teams and re-evaluating their strategies in anticipation of the technology upending much of their work.  Their experiences back up the idea that, for better or worse, AI technology may very soon radically alter some people’s daily lives.  But the organizations also said that the technology required enormous amounts of work to customize to their specific needs, with employees giving daily feedback to the software to train it on terminology and methods specific to their fields, such as education or finance. OpenAI, best known for creating the AI chatbot ChatGPT, can then integrate the data from that work into its own model to potentially make its technology better.  In effect, each of the early testers is a microcosm of what others might go through as access to GPT-4 expands.  “There’s a perception in the marketplace now that you plug into these machines and they give you all the answers,” said Jeff McMillan, head of analytics, data and innovation for Morgan Stanley’s wealth management division.  That’s not true, he said. He said the bank has 300 employees putting some of their time into testing their tech using GPT-4.  “We have a team of people who literally review every response from the prior day,” he said.  For Morgan Stanley, the result has been a specialized chatbot built with GPT-4 that serves as an internal research tool for its staff of financial advisers. McMillan said the tool is trained not only on 60,000 research reports on parts of the global economy, but also 40,000 other internal documents from the firm — making it an expert on any financial subject that a financial adviser might want to look up.  To be sure, the early adopters of GPT-4 are not a random sample of the economy. OpenAI, which became for-profit in 2019, hand-picked the organizations over the past weeks and months.  Critics of OpenAI and its competitors allege that the AI sector has benefited from unskeptical hype over the past several months. OpenAI was looking for positive examples to show when it reached out six months ago to Khan Academy, a nonprofit educational organization, founder Sal Khan said.  “The context was: We’re going to be working on a next generation model; we want to be able to launch it with positive use cases,” he said.  Khan Academy is best known for its videos on YouTube, but since OpenAI reached out, Khan said it has poured resources into creating Khanmigo, a chatbot tutor that is specially trained in established concepts of teaching.  “We collectively spent about 100 hours fine-tuning the model so that it potentially can behave like a really good tutor,” he said.  “If you look at the cost of tutoring, this could be a very, very big deal,” Khan added. “It’s like having an amazing grad student or tutor or professor that you can start talking with in the moment.”  Stripe, a tech company that makes payments software and related products for business, said that when it got early access to GPT-4 in January, it pulled 100 employees from their regular jobs and assigned them to an internal “hackathon” in which each person spent a week on average testing out ideas.  Duolingo, an app for learning languages, got access to GPT-4 in the fall, and employees said that CEO Luis von Ahn was so taken with it that he called a meeting for 8 a.m. the following morning and immediately changed people’s jobs.  “He, after that, said, ‘Pivot your team,’” Edwin Bodge, a product manager, said. “Since then, we’ve been working extremely closely with GPT-4 and with the OpenAI team.”  So far, Duolingo has added a new, paid subscription tier costing $29.99 per month or $167.88 annually, which allows access to a a conversation chatbot in French or Spanish. They’ve also added an AI bot which will explain grammatical concepts to you as you progress through typical Duolingo lessons. According to Bodge, the company has crafted 1,000-2,000 word prompts for GPT-4 that power the bots. The company would not share the prompts upon request. All of the organizations who spoke with NBC News said they were proceeding with some degree of caution, given that AI technology is so new and the potential peril is unknown. Mike Buckley, CEO of Be My Eyes, a company that makes an app for people who are blind or have low vision, said that he’d like to get a test version of the app with GPT-4 into more hands, “but we want to be thoughtful and safe.”  “Could we launch this more broadly to the community in six to eight weeks? It’s possible, but we’re going to go where the data and the use cases take us,” he said.  The company works by connecting low-vision people with volunteers who, on a video call, can describe to app users what is around them — such as a product label in a grocery store, the directions through an airport or the wording in a greeting card. The version with GPT-4 works without a volunteer on the other end because the AI describes what it “sees” with the camera.  One of the app’s blind spokespeople used it to get directions on the London Underground subway system, according to a video she posted on TikTok.  “We’ve tried to break it,” Buckley said, adding that his staff ran thousands of tests. “We’ve slammed the technology as hard as we could for several weeks, and we’ve been pleasantly surprised.”  He said his company hadn’t run into any safety concerns with GPT-4, but it has made errors; for example, mixing up a toaster for a slow-cooker on a website. "
20230330,foxnews,Schools deploy AI technology to protect against active shooters,"WASHINGTON – While most people look to artificial intelligence, or AI, for quick answers to complex problems, a growing number of school districts are turning to the technology to keep their students and staff safe. A school district in Charles County, Maryland, roughly an hour from Washington D.C., is in the process of installing software and hardware which would allow their current security cameras to detect a potential active shooter.ARTIFICIAL INTELLIGENCE 'GODFATHER' ON AI POSSIBLY WIPING OUT HUMANITY: ‘IT'S NOT INCONCEIVABLE’ ""This artificial intelligence has the ability to be able to identify a weapon, to assess what’s going on and how that person is acting,"" said Jason Stoddard, Director of School safety and Security for Charles County Public Schools. The district, through a state grant, is in the process of installing AI gun detection technology at all of its campuses. The cameras, which were installed years prior, will now communicate with a third party monitoring center if a gun is detected.&nbsp;  ""It plays the role of the human being that might or might not be monitoring,"" said Dave Fraser, CEO of Omnilert, which is one of a handful of companies offering the gun detection technology. ""The system is designed to allow for monitors to determine if a threat is real and if so, alert local police and school authorities within seconds.""TENNESSEE SCHOOL SHOOTING: WHAT TO KNOW ABOUT COVENANT SCHOOL IN NASHVILLE ZeroEyes, a Pennsylvania-based AI gun detection company, told Fox News its seen a surge of interest in recent years following multiple mass shootings on school campuses nationwide. The company told FOX it proudly employs law enforcement experts, people who’ve severed on the front lines, to faster assist schools when reviewing threats.  ""We have 135 employees and 80% of them come from the veteran community,"" said Mike Lahiff, CEO of ZeroEyes in an interview with FOX on Wednesday.  Tech experts admit the AI products do have limits and would not detect weapons hidden under coats or in backpacks. In Maryland, school officials said they have a multi-layer plan to deal with security and employ multiple methods for keeping students safe.CLICK HERE TO GET THE FOX NEWS APP ""It's not replacing the pillars that we have, which are building relationships and positive cultures inside our schools by having a well-trained staff and student body,"" added Stoddard."
