Date,NewsPaper,Headline,MainText
20230330,foxnews,Democrats and Republicans coalesce around calls to regulate AI development: 'Congress has to engage',"Lawmakers in the highly-polarized 118th Congress appear to be finding some common ground with regard to artificial intelligence (AI). Several have indicated they would like to see some kind of regulation to rein in the fast-moving sector on the heels of a stunning warning from tech industry leaders. ""I think what you have to do is, to identify what is not allowed in terms of ethics and illegal activities, whether it is AI or not – you impose on AI activities the same level of ethics and privacy that you do for other competencies today,"" Sen. Mike Rounds, a leader of the Senate AI Caucus, told Fox News Digital. Homeland Security and Government Affairs Committee Chair Gary Peters, D-Mich., pointed out to Fox News Digital that his committee had recently held a hearing on the ""pros and cons"" of AI technology. ""I intend to have a series of hearings in Homeland Security and Government Affairs taking up AI and what we should be thinking about,"" Peters added. ARTIFICIAL INTELLIGENCE 'GODFATHER' ON AI POSSIBLY WIPING OUT HUMANITY: ‘IT'S NOT INCONCEIVABLE’  It comes on the heels of a dramatic letter signed by Tesla CEO Elon Musk, Apple co-founder Steve Wozniak and other tech giants calling for a six-month pause to advanced AI developments, citing ""profound risks to society and humanity."" Sen. Michael Bennet, D-Colo., who sent a letter to tech company leaders last week calling for them to consider the safety of children when rolling out AI systems such as chatbots, suggested that an agency could be created to regulate the relatively restriction-free AI industry ""in the long term."" For now, however, the senator said these companies have to police themselves. ""I think we do have a role to play,"" he said when asked if Congress should step in to regulate AI. ""In the long run, I think what we could do is set up, you know, an agency here. They can negotiate on behalf of the American people, so we can actually have a negotiation about privacy… In the near term, I think it’s going to be important for tech to police itself."" AI EXPERTS WEIGH DANGERS, BENEFITS OF CHATGPT ON HUMANS, JOBS AND INFORMATION: ‘DYSTOPIAN WORLD’  Sen. Brian Schatz, D-Hawaii, shared a similar suggestion, pointing out that he co-led legislation in the previous Congress aimed at enacting more barriers on AI’s growth. ""Congress has to sink its teeth into what to do about it. We've worked with [Retired Sen. Rob Portman, R-Ohio] to establish a law for AI, a commission for AI in government,"" Schatz told Fox News Digital. ""I think we should do something broader for AI throughout the private sector. But I think the first step is to recognize that this is a legitimate area for federal policy."" However, in his earlier comments, Rounds questioned whether existing laws were enough to cover the fast-moving sector.&nbsp; ""So if you're in a business, you know that there are certain rules you can't break,"" Rounds said. ""Those same things need to be applied to AI. The question is, do we have the appropriate language in the law today to address the things that AI might create, that we haven't thought about in our existing law?""  Over on the House side, Rep. Ken Buck, R-Colo., a leader in the efforts to crack down on Big Tech, also urged Congress to take the reins. ""With the emergence of AI comes both opportunity and challenges. We have seen the impact and consequences of a decade of inaction on Big Tech. Congress cannot afford to be caught sleeping at the wheel again. AI has great promise but left unscrutinized could be used to spread propaganda, dangerously restructure our economy, and increase the size of current Big Tech monopolies,"" Buck told Fox News Digital. CLICK HERE TO GET THE FOX NEWS APP Sen. JD Vance, R-Ohio, however, broke from his Senate colleagues to caution them to not rush into action before understanding the complicated technology. ""It's way too early to say what role Congress should take. I think right now, we need to understand this a little bit better. And, you know, look –we’re in the very early days of this process,"" Vance said. ""So I wouldn't want to commit to a congressional strategy before we even understand the problem."""
20230330,foxnews,"Unbridled AI tech risks spread of disinformation, requiring policy makers step in with rules: experts","Scores of technology experts and college professors across different academic backgrounds signed onto an open letter calling for a six-month pause on developing rapidly-evolving AI technology, which they say threatens humanity and society.&nbsp; At the heart of the argument for the pause is to give policymakers space to develop safeguards that would allow for researchers to keep developing the technology, but not at the reported threat of upending the lives of people across the world with disinformation.&nbsp; ""The federal government needs to play a central role using legislation and regulations to require the companies to impose much stricter safety measures and guardrails. However, legislation and regulations take time, moving at bureaucratic speed, while generative AI is evolving at exponential speed,"" Geoffrey Odlum, a retired 28-year diplomat who currently serves as president of Odlum Global Strategies, which advises the government and corporations on national security and tech policy issues, told Fox News Digital.&nbsp; Odlum is one of the more than 1,000 signatories of an open letter calling for all AI labs to pause their research for at least six months, arguing ""p​​owerful AI systems should be developed only once we are confident that their effects will be positive and their risks will be manageable."" ELON MUSK, APPLE CO-FOUNDER, OTHER TECH EXPERTS CALL FOR PAUSE ON 'GIANT AI EXPERIMENTS': 'DANGEROUS RACE'  The Elon Musk-backed letter specifically calls for AI labs to pause training systems that are more powerful than GPT-4, the latest deep learning model from OpenAI, which ""exhibits human-level performance on various professional and academic benchmarks,"" according to the lab.&nbsp; After the letter was released Wednesday, some critics dismissed it as ""just dripping with AI hype,"" including the authors behind a study cited in the letter.&nbsp; ""They basically say the opposite of what we say and cite our paper,"" said computer scientist Timnit Gebru on Twitter. Gebru is an author behind a study cited in the letter as alleged proof that ""AI systems with human-competitive intelligence can pose profound risks to society and humanity.""&nbsp; Gebru was joined by her co-author Emily Bender in lambasting the letter, saying their research was not about AI being ""too powerful,"" but instead focused on the risks of AI and its ""concentration of power in the hands of people, about reproducing systems of oppression, about damage to the information ecosystem,"" the Economist reported.&nbsp; ""Legislation and regulations take time, moving at bureaucratic speed, while generative AI is evolving at exponential speed. That's why I support the call for a 6-month pause in further developments[.]"" However, to those who signed on, they described that AI technology has essentially morphed into a dangerous Wild West that needs a governor.&nbsp; Such technology, supporters of the letter say, could be used to create disinformation, including by U.S. adversaries who want to cause chaos stateside. Odlum pointed to AI technology such as Dall-e 2, which can create realistic images depicting a phony arrest of former President Trump or President Biden kneeling to Chinese President Xi Jinping.&nbsp; ""It's clearly fake, but it looks photorealistic. So the average American would see that and freak out,"" Odlum told Fox News Digital.&nbsp; I INTERVIEWED CHATGPT AS IF IT WAS A HUMAN; HERE'S WHAT IT HAD TO SAY THAT GAVE ME CHILLS University of Pennsylvania professor of Medical Ethics and Health Policy, Jonathan D. Moreno, described to Fox News Digital he has similar concerns.&nbsp; ""This specific danger at the moment is our inability to know with confidence whether an AI platform has created a document or even an image - a moving image or a stationary image. We don't know what the system is doing,"" he said.&nbsp;  Currently, the U.S. has a handful of bills in Congress on AI, while some states have also tried to tackle the issue. However, the lack of hard-set rules has reportedly left some consumers and corporations in a confusing limbo, which is why Odlum is calling for the highest echelons of government to roll out uniform regulations.&nbsp; ""The White House does have an AI research office, and they have released what they called an AI Bill of Rights. Which called for the tech industry to develop AI responsibly and to protect data and to make sure algorithms aren't discriminatory,"" Odlum said, adding the document is ""a useful starting point."" CHATGPT NEW ANTI-CHEATING TECHNOLOGY INSTEAD CAN HELP STUDENTS FOOL TEACHERS AI labs that create technology that could be used by bad actors for disinformation or chaos do not currently face consequences for violating guides put forth by the White House or government agencies. To create these rules, the government needs to act swiftly, the retired diplomat said.&nbsp; ""Legislation and regulations take time, moving at bureaucratic speed, while generative AI is evolving at exponential speed. That's why I support the call for a 6-month pause in further developments, to allow the government time to examine the risks and engage the technology industry and civil society in a collaborative way to produce laws and regulations, safety measures and guardrails, to make sure that generative AI is not used by adversaries to create disinformation that divides us any further,"" Odlum said.&nbsp; ""It's not enough for one company to decide what the rules are, and not have a public conversation about it, try to get a sense of how to prevent bad actors. Although this horse may be out of the barn already."" Moreno told Fox News Digital that ""there's really no review at all"" regarding researchers’ work to make computers smarter, saying it is ""something that I think we've kind of let go of without asking industry to do a little more public consideration."" ELON MUSK'S AI WARNING IS 'UNPRECEDENTED' AND SHOWS 'EXTRAORDINARY' LEVEL OF CONCERN, SAYS DOUGLAS MURRAY Moreno has written about AI extensively in recent years, highlighting the question of regulating the industry back in 2019.&nbsp;  ""There is a great deal of regulation concerning biological experiments that could inadvertently create a ‘smart’ laboratory animal—like putting human-sourced neurons into a non-human primate embryo—but none concerning engineering developments that could lead to the singularity,"" Moreno wrote at the time in The Regulatory Review.&nbsp; ""Singularity"" in this context is defined as when a computer reaches superhuman intelligence, and was coined by mathematician Vernor Vinge 30 years ago.&nbsp; ARTIFICIAL INTELLIGENCE 'GODFATHER' ON AI POSSIBLY WIPING OUT HUMANITY: ‘IT'S NOT INCONCEIVABLE’ ""Should some agency like the U.S. Consumer Product Safety Commission be empowered to verify that the standards are being administered? By the time the singularity has been achieved, a recall may be beside the point,"" Moreno wrote.&nbsp; He warned, ""At that point, in the words of the Borg in ""Star Trek,""'resistance is futile.'"" Fast-forward to 2023 when AI has become ""human-competitive at general tasks,"" according to the letter.&nbsp;Moreno said he wishes he were ""optimistic"" about creating rules on AI that would be industry-wide. CLICK HERE TO GET THE FOX NEWS APP ""Am I optimistic that we can actually create some rules that would be industry-wide? I wish I were. But I think at least, It's not enough for one company to decide what the rules are, and not have a public conversation about it, try to get a sense of how to prevent bad actors. Although this horse may be out of the barn already."""
20230330,foxnews,CONGRESS WEIGHS IN: Should tech companies pause 'giant AI experiments' as Elon Musk and others suggest?,"Congressional lawmakers weighed in Thursday on whether companies should pause advanced artificial intelligence training in the wake of an open letter signed by Elon Musk and other tech leaders. ""I think Elon Musk is rightfully being cautious,"" Rep. Brian Mast, a Florida Republican, told Fox News. ""I appreciate that he's looking to put the brakes on, and I agree with it.""  ELON MUSK, APPLE CO-FOUNDER, OTHER TECH EXPERTS CALL FOR PAUSE ON 'GIANT AI EXPERIMENTS': 'DANGEROUS RACE' Musk, 2020 presidential candidate Andrew Yang, Apple co-founder Steve Wozniak and several other tech leaders urged AI labs to pause development of advanced systems in a recent open letter titled ""Pause Giant AI Experiments.""&nbsp; ""AI systems with human-competitive intelligence can pose profound risks to society and humanity,"" warns the letter, which has been signed by more than 1,400 people. The letter asks developers to halt training AI systems more powerful than GPT-4 for at least six months. San Francisco startup OpenAI's GPT-4 is the successor to the popular AI chatbot ChatGPT. SHOULD TECH COMPANIES PAUSE ‘GIANT AI EXPERIMENTS’?  WATCH MORE FOX NEWS DIGITAL ORIGINALS HERE Rep. Victoria Spartz said she's less concerned with Musk's opinion and more concerned with protecting Americans' data and online privacy. ""We as the government have a duty to protect people rights and rights to life, liberty and property and we do not have good definitions on who owns your data,"" the Indiana Republican said. ""Big Tech companies are really abusing that and using unlimited immunity to suppress people's rights. And I think that's very dangerous."" Rep. Marcus Molinaro said innovation is important, but so is protecting privacy.  CLICK HERE TO GET THE FOX NEWS APP ""I would hope we could find some area of common ground to establish the appropriate guardrails,"" the New York Republican said. To hear more from lawmakers, click here."
20230330,foxnews,White House tight-lipped as push for congressional intervention into rapid AI developments heats up,"The White House remains largely on the sidelines of what has become a growing debate among Americans and lawmakers about the rapid developments being made in the artificial intelligence (AI) industry and whether there should be some type of congressional intervention. Fielding questions from the briefing room on Thursday, White House press secretary Karine Jean-Pierre did not say whether the Biden administration would urge lawmakers to federally regulate AI after she was asked by Fox News White House correspondent Peter Doocy about an open letter, which was signed by Tesla CEO Elon Musk, Apple co-founder Steve Wozniak and other tech giants, that cited AI's ""profound risks to society and humanity."" ""It highlights a number of challenges addressed directly in the administration's blueprint for an AI bill of rights, which was released last October,"" Jean-Pierre said of the letter. ""It includes principles and practices AI creators can use to ensure protections related to safety, civil rights, civil liberties are integrated into AI systems from start to finish."" ""Right now, there's a comprehensive process that is underway to ensure a cohesive federal government approach to AI-related risks and opportunities, including how to ensure that AI innovation and deployment proceeds with appropriate prudence and safety foremost in mind,"" she added. ""I don't have anything else to announce at this point, at this time, but there is a comprehensive process in place."" BIDEN ADMIN SILENT AMID GROWING CONCERN FROM LAWMAKERS OVER RAPID DEVELOPMENT OF AI TECHNOLOGY  Doocy pressed Jean-Pierre on the seriousness of the matter and cited comments made by Eliezer Yudkowsky, a decision theorist at the Machine Intelligence Research Institute, who wrote in a recent op-ed that the six-month ""pause"" on developing ""AI systems more powerful than GPT-4"" — as called for by Musk and hundreds of other innovators and experts — understates the ""seriousness of the situation."" He would go further by implementing a moratorium on new large AI learning models that is ""indefinite and worldwide."" ""Many researchers steeped in these issues, including myself, expect that the most likely result of building a superhumanly smart AI, under anything remotely like the current circumstances, is that literally everyone on Earth will die,"" Yudkowsky said. ""Not as in 'maybe possibly some remote chance' but as in 'that is the obvious thing that would happen.'"" ""Would you agree that does not sound good?"" Doocy asked Jean-Pierre of Yudkowsky's claim. ""Your delivery, Peter, it's quite something,"" Jean-Pierre responded with a laugh. ""It sounds crazy, but is it?"" Doocy asked. ""All I can say is that there's a comprehensive process in place. We put out a blueprint back in October, as you know,"" she said in response. ""I don't have anything to share. We have seen the letter. We understand what their concerns are. Again, comprehensive process — we're gonna let that flow."" Doocy then asked Jean-Pierre whether President Biden is ""worried that artificial intelligence could become self-aware."" AI EXPERT WARNS ELON MUSK-SIGNED LETTER DOESN'T GO FAR ENOUGH, SAYS 'LITERALLY EVERYONE ON EARTH WILL DIE' ""Look, we are — again, there is a comprehensive process,"" she said. ""We are taking this very seriously. … I just don't want to get ahead of our findings and what that's going to look like, but it is a cohesive federal government approach to AI-related risks as you just laid out in a very dramatic way.""  ""We're going to move on. But thank you, Peter, for the drama,"" Jean-Pierre added. The Blueprint for an AI Bill of Rights — as referenced by Jean-Pierre during the briefing — was published by the White House Office of Science and Technology Policy in October and is a ""set of five principles and associated practices to help guide the design, use, and deployment of automated systems to protect the rights of the American public in the age of artificial intelligence."" The five principles featured in the blueprint include: safe and effective systems; algorithmic discrimination protections; data privacy; notice and explanation; and human alternatives, consideration and fallback. When reached for comment about the issue and whether the White House has concern over the rapid development of AI or believes it should be federally regulated, Jean-Pierre referred Fox News Digital to the National Security Council (NSC), which serves as Biden's ""principal forum for considering national security and foreign policy matters with his or her senior advisers and cabinet officials."" Despite signaling that it would respond rapidly to Fox News' request, after more than 24 hours, the NSC did not provide comment on the Biden administration's reaction to the call for an AI development moratorium.  CLICK HERE TO GET THE FOX NEWS APP The relative silence from the White House over potentially disruptive developments in AI comes as lawmakers from both sides of the aisle in the 118th Congress appear to be finding common ground in calling for oversight of the burgeoning technology. ""I think what you have to do is to identify what is not allowed in terms of ethics and illegal activities, whether it is AI or not. You impose on AI activities the same level of ethics and privacy that you do for other competencies today,"" South Dakota GOP Sen. Mike Rounds, a leader of the Senate AI Caucus, told Fox News Digital on Wednesday. Sen. Gary Peters, D-Mich., said the Senate Homeland Security and Governmental Affairs Committee, which he chairs, recently held a hearing on the ""pros and cons"" of AI technology. ""I intend to have a series of hearings in Homeland Security and [Governmental] Affairs taking up AI and what we should be thinking about,"" Peters said. Fox News' Chris Pandolfo contributed to this report."
