Date,NewsPaper,Headline,MainText
20230330,foxnews,"Unbridled AI tech risks spread of disinformation, requiring policy makers step in with rules: experts","Scores of technology experts and college professors across different academic backgrounds signed onto an open letter calling for a six-month pause on developing rapidly-evolving AI technology, which they say threatens humanity and society.&nbsp; At the heart of the argument for the pause is to give policymakers space to develop safeguards that would allow for researchers to keep developing the technology, but not at the reported threat of upending the lives of people across the world with disinformation.&nbsp; ""The federal government needs to play a central role using legislation and regulations to require the companies to impose much stricter safety measures and guardrails. However, legislation and regulations take time, moving at bureaucratic speed, while generative AI is evolving at exponential speed,"" Geoffrey Odlum, a retired 28-year diplomat who currently serves as president of Odlum Global Strategies, which advises the government and corporations on national security and tech policy issues, told Fox News Digital.&nbsp; Odlum is one of the more than 1,000 signatories of an open letter calling for all AI labs to pause their research for at least six months, arguing ""p​​owerful AI systems should be developed only once we are confident that their effects will be positive and their risks will be manageable."" ELON MUSK, APPLE CO-FOUNDER, OTHER TECH EXPERTS CALL FOR PAUSE ON 'GIANT AI EXPERIMENTS': 'DANGEROUS RACE' The Elon Musk-backed letter specifically calls for AI labs to pause training systems that are more powerful than GPT-4, the latest deep learning model from OpenAI, which ""exhibits human-level performance on various professional and academic benchmarks,"" according to the lab.&nbsp; After the letter was released Wednesday, some critics dismissed it as ""just dripping with AI hype,"" including the authors behind a study cited in the letter.&nbsp; ""They basically say the opposite of what we say and cite our paper,"" said computer scientist Timnit Gebru on Twitter. Gebru is an author behind a study cited in the letter as alleged proof that ""AI systems with human-competitive intelligence can pose profound risks to society and humanity.""&nbsp; Gebru was joined by her co-author Emily Bender in lambasting the letter, saying their research was not about AI being ""too powerful,"" but instead focused on the risks of AI and its ""concentration of power in the hands of people, about reproducing systems of oppression, about damage to the information ecosystem,"" the Economist reported.&nbsp; ""Legislation and regulations take time, moving at bureaucratic speed, while generative AI is evolving at exponential speed. That's why I support the call for a 6-month pause in further developments[.]"" However, to those who signed on, they described that AI technology has essentially morphed into a dangerous Wild West that needs a governor.&nbsp; Such technology, supporters of the letter say, could be used to create disinformation, including by U.S. adversaries who want to cause chaos stateside. Odlum pointed to AI technology such as Dall-e 2, which can create realistic images depicting a phony arrest of former President Trump or President Biden kneeling to Chinese President Xi Jinping.&nbsp; ""It's clearly fake, but it"
20230330,foxnews,CONGRESS WEIGHS IN: Should tech companies pause 'giant AI experiments' as Elon Musk and others suggest?,"Congressional lawmakers weighed in Thursday on whether companies should pause advanced artificial intelligence training in the wake of an open letter signed by Elon Musk and other tech leaders. ""I think Elon Musk is rightfully being cautious,"" Rep. Brian Mast, a Florida Republican, told Fox News. ""I appreciate that he's looking to put the brakes on, and I agree with it.""  ELON MUSK, APPLE CO-FOUNDER, OTHER TECH EXPERTS CALL FOR PAUSE ON 'GIANT AI EXPERIMENTS': 'DANGEROUS RACE' Musk, 2020 presidential candidate Andrew Yang, Apple co-founder Steve Wozniak and several other tech leaders urged AI labs to pause development of advanced systems in a recent open letter titled ""Pause Giant AI Experiments.""&nbsp; ""AI systems with human-competitive intelligence can pose profound risks to society and humanity,"" warns the letter, which has been signed by more than 1,400 people. The letter asks developers to halt training AI systems more powerful than GPT-4 for at least six months. San Francisco startup OpenAI's GPT-4 is the successor to the popular AI chatbot ChatGPT. SHOULD TECH COMPANIES PAUSE ‘GIANT AI EXPERIMENTS’?  WATCH MORE FOX NEWS DIGITAL ORIGINALS HERE Rep. Victoria Spartz said she's less concerned with Musk's opinion and more concerned with protecting Americans' data and online privacy. ""We as the government have a duty to protect people rights and rights to life, liberty and property and we do not have good definitions on who owns your data,"" the Indiana Republican said. ""Big Tech companies are really abusing that and using unlimited immunity to suppress people's rights. And I think that's very dangerous."" Rep. Marcus Molinaro said innovation is important, but so is protecting privacy.  CLICK HERE TO GET THE FOX NEWS APP ""I would hope we could find some area of common ground to establish the appropriate guardrails,"" the New York Republican said. To hear more from lawmakers, click here."
20230330,foxnews,White House tight-lipped as push for congressional intervention into rapid AI developments heats up,"The White House remains largely on the sidelines of what has become a growing debate among Americans and lawmakers about the rapid developments being made in the artificial intelligence (AI) industry and whether there should be some type of congressional intervention. Fielding questions from the briefing room on Thursday, White House press secretary Karine Jean-Pierre did not say whether the Biden administration would urge lawmakers to federally regulate AI after she was asked by Fox News White House correspondent Peter Doocy about an open letter, which was signed by Tesla CEO Elon Musk, Apple co-founder Steve Wozniak and other tech giants, that cited AI's ""profound risks to society and humanity."" ""It highlights a number of challenges addressed directly in the administration's blueprint for an AI bill of rights, which was released last October,"" Jean-Pierre said of the letter. ""It includes principles and practices AI creators can use to ensure protections related to safety, civil rights, civil liberties are integrated into AI systems from start to finish."" ""Right now, there's a comprehensive process that is underway to ensure a cohesive federal government approach to AI-related risks and opportunities, including how to ensure that AI innovation and deployment proceeds with appropriate prudence and safety foremost in mind,"" she added. ""I don't have anything else to announce at this point, at this time, but there is a comprehensive process in place."" BIDEN ADMIN SILENT AMID GROWING CONCERN FROM LAWMAKERS OVER RAPID DEVELOPMENT OF AI TECHNOLOGY Doocy pressed Jean-Pierre on the seriousness of the matter and cited comments made by Eliezer Yudkowsky, a decision theorist at the Machine Intelligence Research Institute, who wrote in a recent op-ed that the six-month ""pause"" on developing ""AI systems more powerful than GPT-4"" — as called for by Musk and hundreds of other innovators and experts — understates the ""seriousness of the situation."" He would go further by implementing a moratorium on new large AI learning models that is ""indefinite and worldwide."" ""Many researchers steeped in these issues, including myself, expect that the most likely result of building a superhumanly smart AI, under anything remotely like the current circumstances, is that literally everyone on Earth will die,"" Yudkowsky said. ""Not as in 'maybe possibly some remote chance' but as in 'that is the obvious thing that would happen.'"" ""Would you agree that does not sound good?"" Doocy asked Jean-Pierre of Yudkowsky's claim. ""Your delivery, Peter, it's quite something,"" Jean-Pierre responded with a laugh. ""It sounds crazy, but is it?"" Doocy asked. ""All I can say is that there's a comprehensive process in place. We put out a blueprint back in October, as you know,"" she said in response. ""I don't have anything to share. We have seen the letter. We understand what their concerns are. Again, comprehensive process — we're gonna let that flow."" Doocy then asked Jean-Pierre whether President Biden is ""worried that artificial intelligence could become self-aware."" AI EXPERT WARNS ELON MUSK-SIGNED LETTER DOESN'T GO FAR ENOUGH, SAYS 'LITERALLY EVERYONE ON EARTH WILL DIE' ""Look,"
20220125,nbcnews,Timnit Gebru is part of a wave of Black women working to change AI,"A computer scientist who said she was pushed out of her job at Google in December 2020 has marked the one-year anniversary of her ouster with a new research institute aiming to support the creation of ethical artificial intelligence. Timnit Gebru, a known advocate for diversity in AI, announced the launch of the Distributed Artificial Intelligence Research Institute, or DAIR. Its website describes it as “a space for independent, community-rooted AI research free from Big Tech’s pervasive influence.” Part of how Gebru imagines creating such research is by moving away from the Silicon Valley ethos of “move fast and break things” — which was Facebook’s internal motto, coined by Mark Zuckerberg, until 2014 — to instead take a more deliberate approach to creating new technologies that serve marginalized communities. That includes recognizing and mitigating technologies’ potentials for harm from the beginning of their creation process, rather than after they’ve already caused damage to those communities, Gebru told NBC News. “If those are our values, we can’t achieve them without slowing down and without putting in more resources per project that we’re working on,” she said. Gebru said she learned from a December 2020 email from her manager’s manager that she had apparently resigned from her high-profile position as a co-lead of Google’s ethical AI team. Gebru said she never resigned, but was instead fired after requesting that executives explain why they demanded that Gebru retract a paper she co-authored. It was about how large language models — or AI trained on large amounts of text data, a version of which underpins Google’s own search engine — could reinforce racism, sexism and other systems of oppression. Google’s head of research, Jeff Dean, said in a company email the paper “didn’t meet our bar for publication,” though others within the company cast doubt on that claim. Prior to her departure from Google, Gebru also emailed her colleagues informing them of the retraction request and detailing her frustrations with what she characterized as the company’s subpar efforts to create a more diverse and inclusive workplace. The news of the alleged firing made headlines in the tech world and beyond, and it mobilized thousands of Google employees to join a solidarity campaign in support of Gebru, who is also the co-founder of Black in AI. At least two engineers resigned in protest of Gebru’s ousting. Google declined to comment for this story. A year later, DAIR has found financial support from major backers. The MacArthur Foundation, the Ford Foundation, Open Society Foundations, The Rockefeller Foundation and the Kapor Center have provided a cumulative $3.7 million in grants, Gebru said. She plans to publish DAIR’s research findings in both academic journals and alternative platforms and at a slower pace than the traditional timelines of both the tech industry and academia, she said. Researchers will be encouraged to disseminate their findings in forms that are accessible to the public, including websites and different forms of data visualization, Gebru said, adding that use of some DAIR"
20230114,nbcnews,ChatGPT used by mental health tech app in AI experiment with users,"When people log in to Koko, an online emotional support chat service based in San Francisco, they expect to swap messages with an anonymous volunteer. They can ask for relationship advice, discuss their depression or find support for nearly anything else — a kind of free, digital shoulder to lean on. But for a few thousand people, the mental health support they received wasn’t entirely human. Instead, it was augmented by robots. In October, Koko ran an experiment in which GPT-3, a newly popular artificial intelligence chatbot, wrote responses either in whole or in part. Humans could edit the responses and were still pushing the buttons to send them, but they weren’t always the authors. About 4,000 people got responses from Koko at least partly written by AI, Koko co-founder Robert Morris said. The experiment on the small and little-known platform has blown up into an intense controversy since he disclosed it a week ago, in what may be a preview of more ethical disputes to come as AI technology works its way into more consumer products and health services. Morris thought it was a worthwhile idea to try because GPT-3 is often both fast and eloquent, he said in an interview with NBC News. “People who saw the co-written GTP-3 responses rated them significantly higher than the ones that were written purely by a human. That was a fascinating observation,” he said. Morris said that he did not have official data to share on the test. Once people learned the messages were co-created by a machine, though, the benefits of the improved writing vanished. “Simulated empathy feels weird, empty,” Morris wrote on Twitter. When he shared the results of the experiment on Twitter on Jan. 6, he was inundated with criticism. Academics, journalists and fellow technologists accused him of acting unethically and tricking people into becoming test subjects without their knowledge or consent when they were in the vulnerable spot of needing mental health support. His Twitter thread got more than 8 million views. Senders of the AI-crafted messages knew, of course, whether they had written or edited them. But recipients saw only a notification that said: “Someone replied to your post! (written in collaboration with Koko Bot)” without further details of the role of the bot. In a demonstration that Morris posted online, GPT-3 responded to someone who spoke of having a hard time becoming a better person. The chatbot said, “I hear you. You’re trying to become a better person and it’s not easy. It’s hard to make changes in our lives, especially when we’re trying to do it alone. But you’re not alone.” No option was provided to opt out of the experiment aside from not reading the response at all, Morris said. “If you got a message, you could choose to skip it and not read it,” he said. Leslie Wolf, a Georgia State University law professor who writes about and teaches research ethics, said she was worried about how little Koko told people"
20230328,cbsnews,What can Google's AI-powered Bard do? We tested it for you,"MOUNTAIN VIEW -- To use, or not to use, Bard? That is the Shakespearean question an Associated Press reporter sought to answer while testing out Google's artificially intelligent chatbot. The recently rolled-out bot dubbed Bard is the internet search giant's answer to the ChatGPT tool that Microsoft has been melding into its Bing search engine and other software.During several hours of interaction, the AP learned Bard is quite forthcoming about its unreliability and other shortcomings, including its potential for mischief in next year's U.S. presidential election. Even as it occasionally warned of the problems it could unleash, Bard repeatedly emphasized its belief that it will blossom into a force for good. At one point in its recurring soliloquies about its potential upsides, Bard dreamed about living up to the legacy of the English playwright that inspired its name. Bard explained that its creators at Google ""thought Shakespeare would be a good role model for me, as he was a master of language and communication.""But the chatbot also found some admirable traits in ""HAL,"" the fictional computer that killed some of a spacecraft's crew in the 1968 movie ""2001: A Space Odyssey."" Bard hailed HAL's intelligence calling it ""an interesting character"" before acknowledging its dark side.""I think HAL is a cautionary tale about the dangers of artificial intelligence,"" Bard assessed.WHAT'S BETTER — BARD OR BING?Bard praised ChatGPT, describing it as ""a valuable tool that can be used for a variety of purposes, and I am excited to see how it continues to develop in the future."" But Bard then asserted that it is just as intelligent as its rival, which was released late last year by its creator, the Microsoft-backed OpenAI. ""I would say that I am on par with ChatGPT,"" Bard said. ""We both have our own strengths and weaknesses, and we both have the ability to learn and grow.""During our wide-ranging conversation, Bard didn't display any of the disturbing tendencies that have cropped up in ChatGPT, which has likened another AP reporter to Hitler and tried to persuade a New York Times reporter to divorce his wife.IT'S FUNNY, BUT TAMER THAN BINGBard did get a little gooey at one point when asked to write a Shakespearean sonnet and responded seductively in one of the three drafts that it quickly created. ""I love you more than words can ever say, And I will always be there for you,"" Bard effused. ""You are my everything, And I will never let you go. So please accept this sonnet as a token Of my love for you, And know that I will always be yours.""But Bard seems to be deliberately tame most of the time, and probably for good reason, given what's at stake for Google, which has carefully cultivated a reputation for trustworthiness that has established its dominant search engine as the de facto gateway to the internet. An artificial intelligence tool that behaved as erratically as ChatGPT periodically might trigger a backlash that could damage Google's image and perhaps undercut"
20230328,cnn,Look of the Week: What Pope Francis’ AI puffer coat says about the future of fashion,"Over the weekend, a peculiar image of Pope Francis set the internet alight. Widely circulated on social media, the picture shows the 86-year-old pontiff dressed in a chunky longline white puffer coat, cinched at the waist and seemingly layered with other winter weather streetwear. It appeared to be a drastic departure from the typical regalia — robes, stoles and tall, pointed miter hats — often worn in the papal household. The outfit prompted a torrent of tongue-in-cheek questions online: Did the Pope have a new stylist? Has he always had a stylist? Was the look inspired by the backing dancers at Rihanna’s Superbowl show? More than anything, however, social media users exclaimed how they couldn’t believe the image was real. And it wasn’t. Twitter has since attached a contextual footnote to several of the best-performing tweets clarifying that it is AI-generated and was created using the software tool Midjourney. A 31-year-old construction worker from Chicago has since claimed ownership of the viral image. AI (or artificial intelligence) imaging tools are becoming ever more sophisticated. The technology, which generates pictures based on users’ text prompts, has been used to design inclusive fashion shows, create entire graphic novels, and even help envision new forms of architecture. But as AI develops and computer-generated “deep fake” imagery grows more convincing, many are concerned about the ethical implications, including the removal of subjects’ agency (placing people in fabricated scenarios that may be defamatory or malicious, for example) and whether machine learning technology will one day make fake news indiscernible. Just last week, AI-generated photos of Donald Trump being arrested spread like wildfire after the former president wrote on social media that he was expecting to be indicted in connection with a campaign finance investigation in New York. (Trump, who maintains his innocence, has yet to be charged on any counts.) AI and the future of fashion If dressing is an important form of self-expression, then an AI-generated outfit might not only diminish the power and messaging inherent in clothes — but a person’s autonomy. In the papacy, each garment holds religious significance. The color of the Pope’s vestments is specially selected to align with specific celebrations: red can only be worn during specific occasions, such as Palm Sunday, Good Friday and Pentecost, because it represents the blood of Jesus Christ, while pink is worn just twice a year. As such, fake images of the Pope wearing certain clothes outside these — or in countless other — contexts could cause offense, alarm or even mistrust within the Catholic community. Digitally altering someone’s outfit could have a lasting reputational damage, too. A doctored 2005 photo that appeared to show Paris Hilton at a nightclub wearing an inflammatory tank top that read “Stop Being Poor” became one of the most recognizable pop culture images of the early aughts. It added to the public perception of Hilton as an out-of-touch heiress. She publicly addressed the fake image in 2021, insisting people shouldn’t “believe everything you read.” (The vest,"
20240529,foxnews,Fox News AI Newsletter: Musk's AI prediction,"Welcome to Fox News’ Artificial Intelligence newsletter with the latest AI technology advancements. IN TODAY’S NEWSLETTER: - Elon Musk expects AI will replace all human jobs, lead to 'universal high income'- FCC’s proposal to regulate AI in political ads is misguided, commissioner says- Indian military ramps up AI capabilities in effort to keep up with regional powers  SHOW ME THE MONEY: Billionaire entrepreneur Elon Musk reiterated his stance this week that artificial intelligence will eventually eliminate the need for humans to work, giving his vision for how the future will look as the technology continues to rapidly advance. AI IN POLITICAL ADS: The Federal Communications Commission last week proposed a new regulation that would require the use of artificial intelligence in political advertisements to be disclosed, which has one commissioner slamming the move as regulatory overreach ahead of the election.  HI-TECH WAR PLANNING: India, a country blessed with a strong high-tech industry, is applying its brains not just to commercial artificial intelligence but also to its military, as its neighbor and regional rival China continues to pour billions into AI research. CASH INFLUX: Billionaire Elon Musk's artificial intelligence startup xAI announced Sunday that the company raised $6 billion in Series B funding that lifts the company's valuation to $24 billion after the investment.  DON’T BE DUPED: Advanced artificial intelligence scams are lurking behind innocuous search engine queries, leveraging what's known as ""search engine optimization"" to deceive users, according to expert advice from GuidePoint Security, highlighting how cybercriminals manipulate these systems. Subscribe now to get the Fox News Artificial Intelligence Newsletter in your inbox. FOLLOW FOX NEWS ON SOCIAL MEDIA FacebookInstagramYouTubeTwitterLinkedIn SIGN UP FOR OUR OTHER NEWSLETTERS Fox News FirstFox News OpinionFox News LifestyleFox News Health DOWNLOAD OUR APPS Fox NewsFox BusinessFox WeatherFox SportsTubi WATCH FOX NEWS ONLINE Fox News Go STREAM FOX NATION Fox Nation Stay up to date on the latest AI technology advancements and learn about the challenges and opportunities AI presents now and for the future with Fox News&nbsp;here."
